{
  "id": "f_raiders",
  "name": "Ash Dune Riders",
  "tags": [
    "raiders",
    "nomads"
  ],
  "ideology": "Strength through freedom",
  "goals": [
    "control trade routes",
    "undermine town council"
  ],
  "pressure": 0.42,
  "stability": 0.58,
  "resources": {
    "food": 40,
    "mounts": 25,
    "weapons": 60
  },
  "relations": {
    "f_town": -35,
    "f_rangers": -10
  },
  "leaders": [
    "npc_raider_chief"
  ]
}